{"distributions":[{"id":"777genius/agent-code-navigator","kind":"community","packager":"777genius","product_id":"agent-code-navigator","release_policies":[{"current_evidence":[],"minimum_installer_version":"0.1.8","release_sequence":1,"status":"active","targets":[{"authentication":"not_required","client":"codex","delivery":"managed","scopes":["user"]},{"authentication":"not_required","client":"cursor","delivery":"managed","scopes":["user"]},{"authentication":"not_required","client":"copilot","delivery":"managed","scopes":["user"]},{"authentication":"not_required","client":"vscode","delivery":"prepared","scopes":["user"]},{"authentication":"not_required","client":"kiro","delivery":"managed","scopes":["user"]}]}],"releases":[{"agent_plugins_schema":"https://agent-plugins.org/schemas/1.0.0/plugin.schema.json","components":["skills"],"manifest_digest":"sha256:675fb48dff9431f75e2986211039b3bfb04860a84d6a5bd157b9658514a2394e","manifest_name":"agent-code-navigator","package_source":{"path":"plugins/agent-code-navigator","repository":"777genius/universal-agent-plugins","revision":"2ddbb99dd190c1792b79904f9875e6322bccd243"},"package_version":"0.1.0","published_at":"2026-08-09T22:28:33Z","sequence":1,"tree_digest":"sha256:0087169b1eee5fbdf0d000f4f8b328a89aec5c11bc5d2c129f92c5cd62d33c30","tree_digest_algorithm":"agentplugins-tree-sha256-v1"}],"schema_version":1,"status":"active"},{"id":"777genius/atlassian","kind":"community","packager":"777genius","product_id":"atlassian","release_policies":[{"current_evidence":[],"minimum_installer_version":"0.1.8","release_sequence":1,"status":"active","targets":[{"authentication":"required","client":"codex","delivery":"managed","scopes":["user"]},{"authentication":"required","client":"cursor","delivery":"managed","scopes":["user"]},{"authentication":"required","client":"copilot","delivery":"managed","scopes":["user"]},{"authentication":"required","client":"vscode","delivery":"prepared","scopes":["user"]},{"authentication":"required","client":"kiro","delivery":"managed","scopes":["user"]}]}],"releases":[{"agent_plugins_schema":"https://agent-plugins.org/schemas/1.0.0/plugin.schema.json","components":["mcp"],"manifest_digest":"sha256:e83ade754f1251554622e4b48d596ebf72510bd7292b19a7793df4de8e546d04","manifest_name":"atlassian","package_source":{"path":"plugins/atlassian","repository":"777genius/universal-agent-plugins","revision":"2ddbb99dd190c1792b79904f9875e6322bccd243"},"package_version":"0.1.0","published_at":"2026-08-09T22:28:33Z","sequence":1,"tree_digest":"sha256:61e9343e636c6197067504b59b1a77c5466bad2ca97b59aacd5455d4c5301d7a","tree_digest_algorithm":"agentplugins-tree-sha256-v1"}],"schema_version":1,"status":"active"},{"id":"777genius/chrome-devtools","kind":"community","packager":"777genius","product_id":"chrome-devtools","release_policies":[{"current_evidence":[],"minimum_installer_version":"0.1.8","release_sequence":1,"status":"revoked","targets":[{"authentication":"not_required","client":"codex","delivery":"managed","scopes":["user"]},{"authentication":"not_required","client":"cursor","delivery":"managed","scopes":["user"]},{"authentication":"not_required","client":"copilot","delivery":"managed","scopes":["user"]},{"authentication":"not_required","client":"vscode","delivery":"prepared","scopes":["user"]},{"authentication":"not_required","client":"kiro","delivery":"managed","scopes":["user"]}]}],"releases":[{"agent_plugins_schema":"https://agent-plugins.org/schemas/1.0.0/plugin.schema.json","components":["mcp"],"manifest_digest":"sha256:e7d43a8e39b0e83f2c05777e297f6a3884002dc2601d70528b55a44132db8091","manifest_name":"chrome-devtools","package_source":{"path":"plugins/chrome-devtools","repository":"777genius/universal-agent-plugins","revision":"2ddbb99dd190c1792b79904f9875e6322bccd243"},"package_version":"0.1.0","published_at":"2026-08-09T22:28:33Z","sequence":1,"tree_digest":"sha256:46e983660fc3fadfcd51465d66a7dfdf18149f907f54e4b190a3ec1b9ec4f9df","tree_digest_algorithm":"agentplugins-tree-sha256-v1"}],"schema_version":1,"status":"suspended"},{"id":"777genius/chrome-devtools-bridge","kind":"community_bridge","packager":"777genius","product_id":"chrome-devtools","release_policies":[{"current_evidence":[],"minimum_installer_version":"0.1.8","release_sequence":1,"status":"revoked","targets":[{"authentication":"not_required","client":"codex","delivery":"managed","scopes":["user"]},{"authentication":"not_required","client":"cursor","delivery":"managed","scopes":["user"]},{"authentication":"not_required","client":"copilot","delivery":"managed","scopes":["user"]},{"authentication":"not_required","client":"vscode","delivery":"prepared","scopes":["user"]},{"authentication":"not_required","client":"kiro","delivery":"managed","scopes":["user"]}]},{"current_evidence":[],"minimum_installer_version":"0.1.13","release_sequence":2,"status":"active","targets":[{"authentication":"not_required","client":"codex","delivery":"managed","scopes":["user"]},{"authentication":"not_required","client":"cursor","delivery":"managed","scopes":["user"]},{"authentication":"not_required","client":"copilot","delivery":"managed","scopes":["user"]},{"authentication":"not_required","client":"vscode","delivery":"prepared","scopes":["user"]},{"authentication":"not_required","client":"kiro","delivery":"managed","scopes":["user"]}]}],"releases":[{"agent_plugins_schema":"https://agent-plugins.org/schemas/1.0.0/plugin.schema.json","build_provenance":{"upstream_repository":"ChromeDevTools/chrome-devtools-mcp","upstream_revision":"774d78f5eef5e610407a0c92fa6ec5ed74b027e8"},"components":["mcp"],"manifest_digest":"sha256:02a77a0509681567df75e941175b148c1bcdfe0001cec24cfef8300b85547850","manifest_name":"chrome-devtools","package_source":{"path":"plugins/chrome-devtools","repository":"777genius/universal-agent-plugins","revision":"224e4c065c69ff0b4e326e7796283524df9bfd2f"},"package_version":"1.7.0","published_at":"2026-08-22T19:46:28Z","sequence":1,"tree_digest":"sha256:98172304c27836ebcbf842a5970b128ce8b9688ec06dcf136c35f0688691053a","tree_digest_algorithm":"agentplugins-tree-sha256-v1"},{"agent_plugins_schema":"https://agent-plugins.org/schemas/1.0.0/plugin.schema.json","build_provenance":{"upstream_repository":"ChromeDevTools/chrome-devtools-mcp","upstream_revision":"774d78f5eef5e610407a0c92fa6ec5ed74b027e8"},"components":["mcp"],"manifest_digest":"sha256:38c1ccf9c0857300832c140caf1049aaaacaa09594011d45e68b85a416734265","manifest_name":"chrome-devtools","package_source":{"path":"plugins/chrome-devtools","repository":"777genius/universal-agent-plugins","revision":"dcd94db0bfafe5ff5c4b1f1154ee1f7c656c19e4"},"package_version":"1.7.0-uap.1","published_at":"2026-08-25T11:09:52Z","sequence":2,"tree_digest":"sha256:9ecf4bcd3eff01f3cb23a46838f65e5c9e213a29367514b320dc92aee98689ed","tree_digest_algorithm":"agentplugins-tree-sha256-v1"}],"schema_version":1,"status":"active"},{"id":"777genius/cloudflare","kind":"community","packager":"777genius","product_id":"cloudflare","release_policies":[{"current_evidence":[],"minimum_installer_version":"0.1.8","release_sequence":1,"status":"active","targets":[{"authentication":"required","client":"codex","delivery":"managed","scopes":["user"]},{"authentication":"required","client":"cursor","delivery":"managed","scopes":["user"]},{"authentication":"required","client":"copilot","delivery":"managed","scopes":["user"]},{"authentication":"required","client":"vscode","delivery":"prepared","scopes":["user"]},{"authentication":"required","client":"kiro","delivery":"managed","scopes":["user"]}]}],"releases":[{"agent_plugins_schema":"https://agent-plugins.org/schemas/1.0.0/plugin.schema.json","components":["mcp"],"manifest_digest":"sha256:9bec7cfed2ecb217145c2a02658296670a328416566433518b4da0246e91d382","manifest_name":"cloudflare","package_source":{"path":"plugins/cloudflare","repository":"777genius/universal-agent-plugins","revision":"2ddbb99dd190c1792b79904f9875e6322bccd243"},"package_version":"0.1.0","published_at":"2026-08-09T22:28:33Z","sequence":1,"tree_digest":"sha256:3c882fefc11319f5f51753786b53fe0da3978f45d6797dccdcc9f283f61424a5","tree_digest_algorithm":"agentplugins-tree-sha256-v1"}],"schema_version":1,"status":"active"},{"id":"777genius/cloudflare-bindings","kind":"community","packager":"777genius","product_id":"cloudflare-bindings","release_policies":[{"current_evidence":[],"minimum_installer_version":"0.1.8","release_sequence":1,"status":"active","targets":[{"authentication":"required","client":"codex","delivery":"managed","scopes":["user"]},{"authentication":"required","client":"cursor","delivery":"managed","scopes":["user"]},{"authentication":"required","client":"copilot","delivery":"managed","scopes":["user"]},{"authentication":"required","client":"vscode","delivery":"prepared","scopes":["user"]},{"authentication":"required","client":"kiro","delivery":"managed","scopes":["user"]}]}],"releases":[{"agent_plugins_schema":"https://agent-plugins.org/schemas/1.0.0/plugin.schema.json","components":["mcp"],"manifest_digest":"sha256:6b945cf035f784216e71425cf7b6ca477b27a2069d2580e9713a65f5ec2ca0bf","manifest_name":"cloudflare-bindings","package_source":{"path":"plugins/cloudflare-bindings","repository":"777genius/universal-agent-plugins","revision":"2ddbb99dd190c1792b79904f9875e6322bccd243"},"package_version":"0.1.0","published_at":"2026-08-09T22:28:33Z","sequence":1,"tree_digest":"sha256:f5355538e1558c47e51f2249a753fc179352a27e17de213ee6763c4eeac763b5","tree_digest_algorithm":"agentplugins-tree-sha256-v1"}],"schema_version":1,"status":"active"},{"id":"777genius/cloudflare-docs","kind":"community","packager":"777genius","product_id":"cloudflare-docs","release_policies":[{"current_evidence":[],"minimum_installer_version":"0.1.8","release_sequence":1,"status":"active","targets":[{"authentication":"not_required","client":"codex","delivery":"managed","scopes":["user"]},{"app_binding":{"app_key":"cloudflare-docs","id":"plugin_asdk_app_6a78e90cf73481918ef10cdb87cd4bb4","mcp_server":"cloudflare-docs"}